{
  "$schema": "https://json-schema.org/draft/2020-12/schema",
  "$id": "https://con001.dev/schema/layer.schema.json",
  "title": "Layer",
  "description": "A named, attributable, selectable set of interpretations over one Work. See docs/02-layers.md.",
  "type": "object",
  "required": [
    "id",
    "type",
    "work",
    "kind",
    "title",
    "author",
    "license"
  ],
  "additionalProperties": false,
  "properties": {
    "id": {
      "type": "string",
      "pattern": "^layer:[a-z0-9.\\-]+$"
    },
    "type": {
      "const": "Layer"
    },
    "work": {
      "type": "string",
      "pattern": "^work:"
    },
    "kind": {
      "enum": [
        "philological",
        "variant",
        "traditional",
        "historical",
        "devotional",
        "critical",
        "personal",
        "machine"
      ],
      "description": "Closed vocabulary. Drives typography, stacking order and policy. A machine-authored layer can never be filed as 'traditional' or 'critical'."
    },
    "title": {
      "type": "object",
      "minProperties": 1,
      "additionalProperties": {
        "type": "string"
      }
    },
    "author": {
      "$ref": "https://con001.dev/schema/author.schema.json"
    },
    "stance": {
      "type": "string",
      "description": "Declared editorial or doctrinal commitment, e.g. 'advaita', 'neo-confucian'."
    },
    "source": {
      "type": "object",
      "additionalProperties": true,
      "description": "Bibliographic origin of the imported commentary."
    },
    "license": {
      "type": "object",
      "required": [
        "id"
      ],
      "additionalProperties": true,
      "properties": {
        "id": {
          "type": "string"
        }
      }
    },
    "default_in_stack": {
      "type": "boolean",
      "default": false,
      "description": "Machine layers MUST be false — opt-in every time."
    },
    "coverage": {
      "type": "object",
      "additionalProperties": false,
      "properties": {
        "units_total": {
          "type": "integer"
        },
        "units_annotated": {
          "type": "integer"
        }
      }
    },
    "canonical": {
      "type": "object",
      "description": "Canonical standing within this work's own tradition. DECLARED EDITORIALLY, never computed from engagement, and never compared across traditions. Kept strictly separate from the engagement axis so the two can never be blended into one score. See docs/06-salience.md.",
      "required": [
        "weight",
        "basis"
      ],
      "additionalProperties": false,
      "properties": {
        "weight": {
          "type": "number",
          "minimum": 0,
          "maximum": 1
        },
        "basis": {
          "type": "string",
          "minLength": 1,
          "description": "Why this weight. Recorded so it can be argued with rather than inherited silently."
        }
      }
    },
    "direction": {
      "type": "object",
      "description": "The Director Lens Hook: how THIS layer directs a visual rendition of a passage. Reading Gita 2.47 through Sankara and reading it through Tilak should not produce the same image, because they are not describing the same scene. Composed at generation time from every active layer, and always shown to the reader before anything is generated. See docs/12-reader-prototype.md.",
      "required": [
        "register",
        "motifs",
        "avoid"
      ],
      "additionalProperties": false,
      "properties": {
        "register": {
          "type": "string",
          "minLength": 1,
          "description": "The overall visual key this reading implies."
        },
        "motifs": {
          "type": "array",
          "minItems": 1,
          "items": {
            "type": "string"
          }
        },
        "avoid": {
          "type": "array",
          "items": {
            "type": "string"
          },
          "description": "What this reading positively excludes. As load-bearing as the motifs: a Gandhian reading of 2.47 that renders martial glory has not been directed, it has been ignored."
        },
        "palette": {
          "type": "string"
        },
        "figural": {
          "enum": [
            "permitted",
            "blocked"
          ],
          "description": "Hard corpus policy surfaced into the directive itself, so the constraint is visible in the studio rather than discovered at the point of refusal. See docs/04-generative.md."
        }
      }
    }
  },
  "allOf": [
    {
      "if": {
        "properties": {
          "kind": {
            "const": "machine"
          }
        },
        "required": [
          "kind"
        ]
      },
      "then": {
        "properties": {
          "default_in_stack": {
            "const": false
          }
        }
      }
    },
    {
      "if": {
        "properties": {
          "kind": {
            "const": "machine"
          }
        },
        "required": [
          "kind"
        ]
      },
      "then": {
        "properties": {
          "canonical": {
            "properties": {
              "weight": {
                "const": 0
              }
            }
          }
        }
      },
      "$comment": "Machine-authored content carries no canonical weight, by rule."
    }
  ]
}
